{
  "team_name": "Team Alpha",
  "session_id": "example-session-1",
  "meta": {
    "position": "Backend Developer",
    "grade": "Junior",
    "experience": "pet-projects on Django"
  },
  "turns": [
    {
      "turn_id": 1,
      "timestamp": "2026-01-29T12:34:56+00:00",
      "agent_visible_message": "Hi! Let's start. Tell me about your experience relevant to Backend Developer.",
      "user_message": "I have been coding in Python for 3 months.",
      "internal_thoughts": "[Observer]: Weak answer, reduce difficulty or add a hint.",
      "interviewer_action": "decrease",
      "scores": {
        "correctness": 0.3,
        "confidence": 0.4
      }
    },
    {
      "turn_id": 2,
      "timestamp": "2026-01-29T12:35:30+00:00",
      "agent_visible_message": "Let's simplify: can you describe the concept in your own words? What is the difference between a list and a tuple in Python?",
      "user_message": "A list is mutable, a tuple is not.",
      "internal_thoughts": "[Observer]: Strong answer, increase difficulty.",
      "interviewer_action": "increase",
      "scores": {
        "correctness": 0.8,
        "confidence": 0.7
      }
    }
  ],
  "final_feedback": {
    "verdict": {
      "grade": "Junior",
      "recommendation": "Hire",
      "confidence_score": 70
    },
    "technical_review": {
      "topics": [
        {
          "topic": "Python Data Structures",
          "status": "confirmed",
          "notes": "Understands list vs tuple."
        }
      ],
      "confirmed_skills": ["Python Data Structures"],
      "knowledge_gaps": []
    },
    "soft_skills": {
      "clarity": "Average",
      "honesty": "Clear answers",
      "engagement": "Neutral"
    },
    "personal_roadmap": []
  }
}
